{
  "operator": "chr_0026_lastrite",
  "level": 90,
  "promotion": 4,
  "potential": 5,
  "skillLevels": {
    "basic": 12,
    "battle": 12,
    "combo": 12,
    "ultimate": 12
  },
  "weapon": {
    "id": "wpn_claym_0013",
    "level": 90,
    "skillLevels": [
      9,
      9,
      9
    ]
  },
  "gear": [
    { "id": "item_equip_t4_suit_burst01_hand_01", "artifice": [3, 3, 3] },
    { "id": "item_equip_t4_suit_burst01_body_03", "artifice": [3, 3, 3] },
    { "id": "item_equip_t4_suit_burst01_edc_01", "artifice": [3, 3, 3] },
    { "id": "item_equip_t4_suit_heal01_edc_03", "artifice": [3, 3, 3] }
  ]
}
