{
  "operator": "chr_0032_lizhiyan",
  "level": 90,
  "promotion": 4,
  "potential": 4,
  "skillLevels": {
    "basic": 11,
    "battle": 12,
    "combo": 12,
    "ultimate": 12
  },
  "weapon": {
    "id": "wpn_funnel_0016",
    "level": 90,
    "skillLevels": [
      9,
      9,
      5
    ]
  },
  "gear": [
    {
      "id": "item_equip_t4_suit_usp02_hand_04",
      "artifice": [
        3,
        0,
        3
      ]
    },
    {
      "id": "item_equip_t4_suit_usp02_body_03",
      "artifice": [
        3,
        3,
        0
      ]
    },
    {
      "id": "item_equip_t4_suit_usp02_edc_04",
      "artifice": [
        3,
        3,
        0
      ]
    },
    {
      "id": "item_equip_t4_suit_usp02_edc_04",
      "artifice": [
        3,
        3,
        0
      ]
    }
  ]
}
