{
  "operator": "chr_0012_avywen",
  "level": 90,
  "promotion": 4,
  "potential": 5,
  "skillLevels": {
    "basic": 12,
    "battle": 12,
    "combo": 12,
    "ultimate": 12
  },
  "weapon": {
    "id": "wpn_lance_0006",
    "level": 90,
    "skillLevels": [9, 9, 9]
  },
  "gear": [
    { "id": "item_equip_t4_suit_pulse_cryst01_hand_01", "artifice": [3, 3, 3] },
    { "id": "item_equip_t4_suit_pulse_cryst01_body_01", "artifice": [3, 3, 3] },
    { "id": "item_equip_t4_suit_pulse_cryst01_edc_01", "artifice": [3, 3, 3] },
    { "id": "item_equip_t4_suit_pulse_cryst01_edc_02", "artifice": [3, 3, 3] }
  ]
}
