{
  "operator": "chr_0019_karin",
  "level": 90,
  "promotion": 4,
  "potential": 5,
  "talents": [2, 1],
  "skillLevels": {
    "basic": 12,
    "battle": 12,
    "combo": 12,
    "ultimate": 12
  },
  "weapon": {
    "id": "wpn_sword_0009",
    "level": 90,
    "skillLevels": [9, 9, 9]
  },
  "gear": [
    { "id": "item_equip_t4_suit_atb01_hand_03", "artifice": [3, 3, 3] },
    { "id": "item_equip_t4_suit_atb01_body_05", "artifice": [3, 3, 3] },
    { "id": "item_equip_t4_suit_atb01_edc_04", "artifice": [3, 3, 3] },
    { "id": "item_equip_t4_suit_atb01_edc_06", "artifice": [3, 3, 3] }
  ]
}
