{
  "operator": "chr_0033_camille",
  "level": 90,
  "promotion": 4,
  "potential": 3,
  "skillLevels": {
    "basic": 12,
    "battle": 12,
    "combo": 12,
    "ultimate": 12
  },
  "weapon": {
    "id": "wpn_lance_0015",
    "level": 90,
    "skillLevels": [9, 9, 4]
  },
  "gear": [
    { "id": "item_equip_t4_suit_atb01_hand_03", "artifice": [3, 3, 3] },
    { "id": "item_equip_t4_suit_atb01_body_05", "artifice": [3, 3, 3] },
    { "id": "item_equip_t4_suit_atb01_edc_04", "artifice": [3, 3, 3] },
    { "id": "item_equip_t4_parts_wuling01_edc_03", "artifice": [3, 3, 0] }
  ]
}
