{
  "operator": "chr_0034_typhoea",
  "level": 90,
  "promotion": 4,
  "potential": 5,
  "skillLevels": {
    "basic": 12,
    "battle": 12,
    "combo": 12,
    "ultimate": 12
  },
  "weapon": {
    "id": "wpn_funnel_0019",
    "level": 90,
    "skillLevels": [
      9,
      9,
      9
    ]
  },
  "gear": [
    {
      "id": "item_equip_t4_suit_spellburst_hand_01",
      "artifice": [
        3,
        3,
        3
      ]
    },
    {
      "id": "item_equip_t4_suit_spellburst_body_01",
      "artifice": [
        3,
        3,
        3
      ]
    },
    {
      "id": "item_equip_t4_suit_spellburst_edc_01",
      "artifice": [
        3,
        3,
        3
      ]
    },
    {
      "id": "item_equip_t4_suit_heal01_edc_03",
      "artifice": [
        3,
        3,
        3
      ]
    }
  ]
}
