{
  "operator": "chr_0014_aurora",
  "level": 90,
  "promotion": 4,
  "potential": 5,
  "skillLevels": {
    "basic": 12,
    "battle": 12,
    "combo": 12,
    "ultimate": 12
  },
  "weapon": {
    "id": "wpn_claym_0011",
    "level": 90,
    "skillLevels": [
      9,
      9,
      9
    ]
  },
  "gear": []
}
