{
  "operator": "chr_0031_mifu",
  "level": 90,
  "promotion": 4,
  "potential": 5,
  "skillLevels": {
    "basic": 12,
    "battle": 12,
    "combo": 12,
    "ultimate": 12
  },
  "weapon": { "id": "wpn_claym_0017", "level": 90, "skillLevels": [9, 9, 9] },
  "gear": [
    { "id": "item_equip_t4_suit_crush_fracture_body_01", "artifice": [3, 3, 3] },
    { "id": "item_equip_t4_suit_crush_fracture_hand_01", "artifice": [3, 3, 3] },
    { "id": "item_equip_t4_suit_crush_fracture_edc_01", "artifice": [3, 3, 3] },
    { "id": "item_equip_t4_suit_attri01_edc_03", "artifice": [3, 3, 3] }
  ]
}
