{
  "operator": "chr_0004_pelica",
  "level": 90,
  "promotion": 4,
  "potential": 5,
  "skillLevels": { "basic": 12, "battle": 12, "combo": 12, "ultimate": 12 },
  "weapon": { "id": "wpn_funnel_0004", "level": 90, "skillLevels": [9, 9, 9] },
  "gear": [
    { "id": "item_equip_t3_suit_wisd01_hand_01", "artifice": [3, 3, 3] },
    { "id": "item_equip_t3_suit_wisd01_body_01", "artifice": [3, 3, 3] },
    { "id": "item_equip_t3_suit_wisd01_edc_01", "artifice": [3, 3, 3] },
    { "id": "item_equip_t3_suit_wisd01_edc_02", "artifice": [3, 3, 3] }
  ]
}
