{
  "operator": "chr_0027_tangtang",
  "level": 90,
  "promotion": 4,
  "potential": 5,
  "skillLevels": {
    "basic": 11,
    "battle": 12,
    "combo": 12,
    "ultimate": 12
  },
  "weapon": {
    "id": "wpn_pistol_0011",
    "level": 90,
    "skillLevels": [
      9,
      9,
      9
    ]
  },
  "gear": [
    {
      "id": "item_equip_t4_suit_criti01_hand_01",
      "artifice": [
        3,
        3,
        3
      ]
    },
    {
      "id": "item_equip_t4_suit_attri01_body_05",
      "artifice": [
        3,
        3,
        3
      ]
    },
    {
      "id": "item_equip_t4_suit_attri01_edc_07",
      "artifice": [
        3,
        3,
        3
      ]
    },
    {
      "id": "item_equip_t4_suit_attri01_edc_07",
      "artifice": [
        3,
        3,
        3
      ]
    }
  ]
}
