{
  "operator": "chr_0022_bounda",
  "level": 90,
  "promotion": 4,
  "potential": 5,
  "skillLevels": { "basic": 12, "battle": 12, "combo": 12, "ultimate": 12 },
  "weapon": { "id": "wpn_pistol_0002", "level": 90, "skillLevels": [9, 9, 9] },
  "gear": [
    { "id": "item_equip_t3_suit_atk01_hand_01", "artifice": [3, 3, 3] },
    { "id": "item_equip_t3_suit_atk01_body_03", "artifice": [3, 3, 3] },
    { "id": "item_equip_t3_suit_atk01_edc_01", "artifice": [3, 3, 3] },
    { "id": "item_equip_t3_suit_atk01_edc_04", "artifice": [3, 3, 3] }
  ]
}
