{
  "operator": "chr_0016_laevat",
  "level": 90,
  "promotion": 4,
  "potential": 5,
  "talents": [
    3,
    2
  ],
  "skillLevels": {
    "basic": 12,
    "battle": 12,
    "combo": 12,
    "ultimate": 12
  },
  "weapon": {
    "id": "wpn_sword_0010",
    "level": 90,
    "skillLevels": [
      9,
      9,
      9
    ]
  },
  "gear": [
    {
      "id": "item_equip_t4_suit_burst01_body_01",
      "artifice": [
        3,
        3,
        3
      ]
    },
    {
      "id": "item_equip_t4_suit_fire_natr01_hand_02",
      "artifice": [
        3,
        3,
        3
      ]
    },
    {
      "id": "item_equip_t4_parts_wuling01_edc_03",
      "artifice": [
        3,
        3,
        3
      ]
    },
    {
      "id": "item_equip_t4_parts_wuling01_edc_03",
      "artifice": [
        3,
        3,
        3
      ]
    }
  ]
}
