{
  "operator": "chr_0011_seraph",
  "level": 90,
  "promotion": 4,
  "potential": 5,
  "skillLevels": { "basic": 12, "battle": 12, "combo": 12, "ultimate": 12 },
  "weapon": { "id": "wpn_funnel_0014", "level": 90, "skillLevels": [9, 9, 9] },
  "gear": [
    { "id": "item_equip_t4_parts_wuling00_hand_03", "artifice": [3, 3, 3] },
    { "id": "item_equip_t4_suit_atb01_body_04", "artifice": [3, 3, 3] },
    { "id": "item_equip_t4_suit_atb01_edc_06", "artifice": [3, 3, 3] },
    { "id": "item_equip_t4_suit_atb01_edc_06", "artifice": [3, 3, 3] }
  ]
}
