{
  "operator": "chr_0017_yvonne",
  "level": 90,
  "promotion": 4,
  "potential": 5,
  "skillLevels": { "basic": 12, "battle": 12, "combo": 12, "ultimate": 12 },
  "weapon": { "id": "wpn_pistol_0005", "level": 90, "skillLevels": [9, 9, 9] },
  "gear": [
    { "id": "item_equip_t4_suit_criti01_hand_02", "artifice": [3, 3, 3] },
    { "id": "item_equip_t4_suit_criti01_body_02", "artifice": [3, 3, 3] },
    { "id": "item_equip_t4_suit_criti01_edc_03", "artifice": [3, 3, 3] },
    { "id": "item_equip_t4_suit_criti01_edc_03", "artifice": [3, 3, 3] }
  ]
}
