{
  "operator": "chr_0025_ardelia",
  "level": 90,
  "promotion": 4,
  "potential": 0,
  "skillLevels": {
    "basic": 12,
    "battle": 12,
    "combo": 12,
    "ultimate": 12
  },
  "weapon": {
    "id": "wpn_funnel_0013",
    "level": 90,
    "skillLevels": [9, 9, 9]
  },
  "gear": [
    { "id": "item_equip_t4_suit_fire_natr01_hand_02", "artifice": [3, 3, 3] },
    { "id": "item_equip_t4_suit_fire_natr01_body_01", "artifice": [3, 3, 3] },
    { "id": "item_equip_t4_suit_fire_natr01_edc_03", "artifice": [3, 3, 3] },
    { "id": "item_equip_t4_suit_fire_natr01_edc_01", "artifice": [3, 3, 3] }
  ]
}
